{
  "$schema": "./tokens.schema.json",
  "name": "Penumbra",
  "displayName": "Penumbra",
  "description": "Pitch-black VS Code theme with rounded floating islands and per-language accent tints.",
  "type": "dark",

  "palette": {
    "canvas":      "#000000",
    "surface0":    "#060608",
    "surface1":    "#0E0E12",
    "surface2":    "#16161C",
    "surface3":    "#20202A",
    "line":        "#1A1A22",
    "text":        "#E6E6EB",
    "textMuted":   "#8A8A95",
    "textFaint":   "#525260",
    "accent":      "#7C7CFF",
    "success":     "#4ADE80",
    "warn":        "#F59E0B",
    "error":       "#F87171",
    "info":        "#60A5FA"
  },

  "syntax": {
    "comment":     "#525260",
    "keyword":     "#B19CD9",
    "constant":    "#D8939E",
    "string":      "#D9B872",
    "stringEsc":   "#E5C99A",
    "function":    "#7FAED9",
    "type":        "#7BC9A7",
    "property":    "#9DB9D9",
    "variable":    "#DCDCE3",
    "parameter":   "#DCDCE3",
    "operator":    "#6E6E78",
    "punctuation": "#6E6E78",
    "tag":         "#D9939E",
    "attribute":   "#9DB9D9",
    "regex":       "#7BC9A7",
    "decorator":   "#B19CD9",
    "markupHead":  "#7FAED9",
    "markupLink":  "#7FAED9",
    "markupCode":  "#D9B872",
    "diffAdd":     "#4ADE80",
    "diffRemove":  "#F87171"
  },

  "italics": [
    "comment",
    "keyword",
    "decorator",
    "constant"
  ],

  "languageTints": {
    "_default":         "#7C7CFF",
    "typescript":       "#3B82F6",
    "typescriptreact":  "#3B82F6",
    "javascript":       "#EAB308",
    "javascriptreact":  "#EAB308",
    "python":           "#FBBF24",
    "rust":             "#F97316",
    "go":               "#06B6D4",
    "ruby":             "#EF4444",
    "markdown":         "#A78BFA",
    "json":             "#94A3B8",
    "jsonc":            "#94A3B8",
    "yaml":             "#94A3B8",
    "toml":             "#94A3B8",
    "shellscript":      "#22C55E",
    "bash":             "#22C55E",
    "zsh":              "#22C55E",
    "css":              "#EC4899",
    "scss":             "#EC4899",
    "less":             "#EC4899",
    "html":             "#F87171",
    "vue":              "#10B981",
    "svelte":           "#F43F5E",
    "java":             "#DC2626",
    "kotlin":           "#DC2626",
    "scala":            "#DC2626",
    "cpp":              "#8B5CF6",
    "c":                "#8B5CF6",
    "csharp":           "#8B5CF6",
    "objective-c":      "#8B5CF6",
    "sql":              "#0EA5E9",
    "php":              "#6366F1",
    "swift":            "#FB923C",
    "dart":             "#0891B2",
    "lua":              "#3B82F6",
    "haskell":          "#A855F7",
    "elixir":           "#A855F7",
    "clojure":          "#22D3EE",
    "dockerfile":       "#0EA5E9",
    "terraform":        "#7C3AED",
    "hcl":              "#7C3AED"
  },

  "radii": {
    "panel":  16,
    "widget": 12,
    "input":  10,
    "item":    6,
    "pill":  999
  },

  "gaps": {
    "outer": 8,
    "top":   8
  }
}
